{
  "operator": "example-developer",
  "subscriptions": [
    {
      "rail": "codex",
      "plan": "example-subscription",
      "windows": [
        "five_hour",
        "weekly"
      ],
      "probe": "none",
      "notes": "Known rails use the built-in probe before any profile command."
    },
    {
      "rail": "moonshot-subscription",
      "plan": "example-plan",
      "windows": [
        "five_hour",
        "weekly"
      ],
      "probe": "moonshot-usage --json",
      "notes": "Example only. The command emits the conservative common probe shape and contains no credentials."
    }
  ],
  "familyPreferenceOrder": [
    "openai",
    "anthropic",
    "moonshot"
  ],
  "neverUse": [
    "example-provider/example-model"
  ],
  "updated": "2026-08-08T00:00:00Z"
}
